headline,source,datetime,headline,sentiment,score,date
Attention Dividend Investors: 4 Stocks To Build Your Own Income Factory,SeekingAlpha,2025-05-27 07:20:00,Attention Dividend Investors: 4 Stocks To Build Your Own Income Factory,neutral,0.9166117310523987,2025-05-27
Pzena Global Value ADR Q1 2025 Commentary,SeekingAlpha,2025-05-27 06:00:00,Pzena Global Value ADR Q1 2025 Commentary,neutral,0.9407844543457031,2025-05-27
"How To Build A $100,000 Dividend Portfolio That Could Yield 10.75% In 15 Years",SeekingAlpha,2025-05-26 16:00:00,"How To Build A $100,000 Dividend Portfolio That Could Yield 10.75% In 15 Years",neutral,0.837814211845398,2025-05-27
Bank Of America Corporation's Long Position In Bilibili Increased To 8.02% On May 21 - HKEX,Finnhub,2025-05-26 06:11:14,Bank Of America Corporation's Long Position In Bilibili Increased To 8.02% On May 21 - HKEX,positive,0.9465246796607971,2025-05-27
"Bank of America Announces Redemption of CHF 375 Million of 0.2525% Senior Notes, Due June 12, 2026",Finnhub,2025-05-26 05:46:06,"Bank of America Announces Redemption of CHF 375 Million of 0.2525% Senior Notes, Due June 12, 2026",neutral,0.8468505144119263,2025-05-27
Elusive Peace Hits Ukraine’s Bonds While Neighbor Markets Surge,Yahoo,2025-05-25 12:30:00,Elusive Peace Hits Ukraine’s Bonds While Neighbor Markets Surge,positive,0.5076294541358948,2025-05-27
Warren Buffett Sold Bank of America and Citigroup and Is Piling Into This High-Yield Investment Instead,Yahoo,2025-05-25 09:25:00,Warren Buffett Sold Bank of America and Citigroup and Is Piling Into This High-Yield Investment Instead,neutral,0.9198613166809082,2025-05-27
Investing in Dividend Stocks: The Stability of Warren Buffett's Picks,Yahoo,2025-05-24 22:05:00,Investing in Dividend Stocks: The Stability of Warren Buffett's Picks,neutral,0.8673434257507324,2025-05-27
Bank of America (NYSE:BAC) Set to Redeem CHF 375 Million Senior Notes Early,Yahoo,2025-05-23 17:19:15,Bank of America (NYSE:BAC) Set to Redeem CHF 375 Million Senior Notes Early,neutral,0.9044935703277588,2025-05-27
Why Goldman Sachs' tech chief envisions a future of humans managing AI agents,Yahoo,2025-05-23 12:35:17,Why Goldman Sachs' tech chief envisions a future of humans managing AI agents,neutral,0.916223406791687,2025-05-27
US Long-Term Borrowing Costs Surge Over Deficit Concerns,Yahoo,2025-05-23 11:39:54,US Long-Term Borrowing Costs Surge Over Deficit Concerns,negative,0.7032020688056946,2025-05-27
Bank of America : Subsidiary Information Factsheet (MLI Fact Sheet May 2025 ADA,Finnhub,2025-05-23 11:22:15,Bank of America : Subsidiary Information Factsheet (MLI Fact Sheet May 2025 ADA,neutral,0.9484116435050964,2025-05-27
BofA’s Hartnett Says Buy the Dip in Treasuries as Yields Top 5%,Yahoo,2025-05-23 09:45:09,BofA’s Hartnett Says Buy the Dip in Treasuries as Yields Top 5%,positive,0.5599818825721741,2025-05-27
Wall Street Breakfast Podcast: Banking Titans In Early Talks For Shared Stablecoin,SeekingAlpha,2025-05-23 06:34:45,Wall Street Breakfast Podcast: Banking Titans In Early Talks For Shared Stablecoin,neutral,0.829841673374176,2025-05-27
"50 Largest U.S. Banks By Total Assets, Q1 2025",SeekingAlpha,2025-05-23 06:10:00,"50 Largest U.S. Banks By Total Assets, Q1 2025",neutral,0.9334264397621155,2025-05-27
Big Banks Explore Venturing Into Crypto World Together With Joint Stablecoin,DowJones,2025-05-22 23:16:00,Big Banks Explore Venturing Into Crypto World Together With Joint Stablecoin,positive,0.7351973652839661,2025-05-27
Target’s troubles leave analysts most negative since 2018,Yahoo,2025-05-22 20:44:53,Target’s troubles leave analysts most negative since 2018,negative,0.9701143503189087,2025-05-27
Hinge Health Jumps 17% After Top-Priced $437 Million IPO,Yahoo,2025-05-22 20:12:19,Hinge Health Jumps 17% After Top-Priced $437 Million IPO,positive,0.8767957091331482,2025-05-27
Did You Survive The Great Crash Of 2025?,SeekingAlpha,2025-05-22 13:05:00,Did You Survive The Great Crash Of 2025?,neutral,0.9112679362297058,2025-05-27
Bank of America Corporation (BAC) is Attracting Investor Attention: Here is What You Should Know,Yahoo,2025-05-22 13:00:13,Bank of America Corporation (BAC) is Attracting Investor Attention: Here is What You Should Know,neutral,0.9158616662025452,2025-05-27
Bank Of America Discloses 5.58% Stake In National Grid As Of May 19 Vs Prior Stake Of 1.82%,Finnhub,2025-05-22 12:34:19,Bank Of America Discloses 5.58% Stake In National Grid As Of May 19 Vs Prior Stake Of 1.82%,neutral,0.9369105696678162,2025-05-27
BNY Mellon Dynamic Value Fund Q1 2025 Commentary,SeekingAlpha,2025-05-22 11:14:00,BNY Mellon Dynamic Value Fund Q1 2025 Commentary,neutral,0.9445189237594604,2025-05-27
Jamie Dimon Says JPMorgan Was Right to Do CATL Deal Despite Opposition,Yahoo,2025-05-22 07:40:11,Jamie Dimon Says JPMorgan Was Right to Do CATL Deal Despite Opposition,neutral,0.8455572128295898,2025-05-27
"Bank ETFs, Bank of America post big drops as Treasury yields jump",MarketWatch,2025-05-21 15:45:39,"Bank ETFs, Bank of America post big drops as Treasury yields jump",negative,0.9486803412437439,2025-05-27
I Sold These Big Bank Stocks Hand Over Fist,SeekingAlpha,2025-05-21 15:35:00,I Sold These Big Bank Stocks Hand Over Fist,neutral,0.9177893996238708,2025-05-27
JPMorgan launches ‘special forces’ unit to protect clients from political risks,MarketWatch,2025-05-21 12:55:00,JPMorgan launches ‘special forces’ unit to protect clients from political risks,neutral,0.8743718266487122,2025-05-27
Giant US companies are rushing to Europe to borrow money,Yahoo,2025-05-21 11:00:24,Giant US companies are rushing to Europe to borrow money,neutral,0.655924916267395,2025-05-27
"Forget About Dividend Yield, Do This Instead",SeekingAlpha,2025-05-21 09:00:00,"Forget About Dividend Yield, Do This Instead",neutral,0.9142321348190308,2025-05-27
My Dividend Stock Portfolio: New All-Time Dividend Record In April - 100 Holdings With 14 Buys,SeekingAlpha,2025-05-21 08:10:00,My Dividend Stock Portfolio: New All-Time Dividend Record In April - 100 Holdings With 14 Buys,positive,0.5043931603431702,2025-05-27
58% of Warren Buffett's $287 Billion Portfolio at Berkshire Hathaway Is Invested in Just 4 Unstoppable Stocks,Yahoo,2025-05-21 07:06:00,58% of Warren Buffett's $287 Billion Portfolio at Berkshire Hathaway Is Invested in Just 4 Unstoppable Stocks,neutral,0.9491868615150452,2025-05-27
Fitch Assigns 'F1+' Rating to Merrill Lynch B.V.'s EUR40 Million Senior Secured Notes,Finnhub,2025-05-21 04:34:21,Fitch Assigns 'F1+' Rating to Merrill Lynch B.V.'s EUR40 Million Senior Secured Notes,neutral,0.7825373411178589,2025-05-27
QR Sign-Ins Surge 60% on BofA's CashPro Platform,Finnhub,2025-05-21 04:01:09,QR Sign-Ins Surge 60% on BofA's CashPro Platform,positive,0.929879367351532,2025-05-27
Moody’s Downgrades Top Banks as Retail Investors Rally with Record Stock Buying,Yahoo,2025-05-21 02:14:05,Moody’s Downgrades Top Banks as Retail Investors Rally with Record Stock Buying,negative,0.9469380378723145,2025-05-27
Bank of America (BAC) Stock Moves -0.18%: What You Should Know,Yahoo,2025-05-20 21:45:13,Bank of America (BAC) Stock Moves -0.18%: What You Should Know,neutral,0.8655040264129639,2025-05-27
"JPM, BAC, and MS: How U.S. Bank Stocks Line Up in the Trump Era",Yahoo,2025-05-20 19:00:00,"JPM, BAC, and MS: How U.S. Bank Stocks Line Up in the Trump Era",neutral,0.9048742055892944,2025-05-27
How To Trade A Cash-Secured Put With Bank Of America Stock,Yahoo,2025-05-20 16:28:18,How To Trade A Cash-Secured Put With Bank Of America Stock,neutral,0.9413962960243225,2025-05-27
QR Sign-Ins Surge 60% on BofA's CashPro® Platform,Yahoo,2025-05-20 13:05:00,QR Sign-Ins Surge 60% on BofA's CashPro® Platform,positive,0.9266008138656616,2025-05-27
U.S. Banks' Ratings Cut by Moody's on Rising Sovereign Debt Concerns,Yahoo,2025-05-20 11:55:00,U.S. Banks' Ratings Cut by Moody's on Rising Sovereign Debt Concerns,negative,0.9636510014533997,2025-05-27
JPMorgan and Citi See European Stocks Blowing Past the US,Yahoo,2025-05-20 10:55:02,JPMorgan and Citi See European Stocks Blowing Past the US,positive,0.7409982085227966,2025-05-27
Bank of America provides enhanced cash back rewards for new cardholders,Finnhub,2025-05-20 09:11:10,Bank of America provides enhanced cash back rewards for new cardholders,positive,0.6919861435890198,2025-05-27
Tesla Supplier CATL Soars in HK Debut After World’s Top Listing This Year,Yahoo,2025-05-20 09:03:21,Tesla Supplier CATL Soars in HK Debut After World’s Top Listing This Year,positive,0.8955352902412415,2025-05-27
