headline,source,datetime,headline,sentiment,score,date
Costco: Tariffs Imply A Mistimed Membership Fee Hike - My Contrarian View,SeekingAlpha,2025-05-27 10:14:54,Costco: Tariffs Imply A Mistimed Membership Fee Hike - My Contrarian View,negative,0.6893282532691956,2025-05-28
Attention Dividend Investors: 4 Stocks To Build Your Own Income Factory,SeekingAlpha,2025-05-27 07:20:00,Attention Dividend Investors: 4 Stocks To Build Your Own Income Factory,neutral,0.9166117310523987,2025-05-28
What To Expect in the Markets This Week,Yahoo,2025-05-25 09:00:00,What To Expect in the Markets This Week,neutral,0.9187409281730652,2025-05-28
"Nvidia, Costco, and Fed minutes: What to watch in the stock market this week",Yahoo,2025-05-25 09:00:00,"Nvidia, Costco, and Fed minutes: What to watch in the stock market this week",neutral,0.9221469759941101,2025-05-28
Wall Street Week Ahead,SeekingAlpha,2025-05-25 06:08:01,Wall Street Week Ahead,neutral,0.7665469646453857,2025-05-28
"Got $5,000? 2 Reliable Stocks to Buy and Hold Forever.",Yahoo,2025-05-24 22:15:00,"Got $5,000? 2 Reliable Stocks to Buy and Hold Forever.",neutral,0.9214804768562317,2025-05-28
"Is Home Depot or Costco the Better Stock to Buy Right Now With $1,000?",Yahoo,2025-05-24 14:30:00,"Is Home Depot or Costco the Better Stock to Buy Right Now With $1,000?",neutral,0.9166581034660339,2025-05-28
"Nvidia, Dell, Salesforce To Report Earnings Next Week",SeekingAlpha,2025-05-24 11:00:00,"Nvidia, Dell, Salesforce To Report Earnings Next Week",neutral,0.9095286130905151,2025-05-28
Robert Kiyosaki Says US Heading for 'Greater Depression' But You Can Become 'Very Rich Person' In This Crisis If You Do This,Yahoo,2025-05-23 23:00:50,Robert Kiyosaki Says US Heading for 'Greater Depression' But You Can Become 'Very Rich Person' In This Crisis If You Do This,neutral,0.7556524276733398,2025-05-28
"Nvidia earnings, Fed Chair Powell, April PCE: What to Watch",Yahoo,2025-05-23 23:00:36,"Nvidia earnings, Fed Chair Powell, April PCE: What to Watch",neutral,0.9084919095039368,2025-05-28
Taking Stock of the Earnings Picture,Yahoo,2025-05-23 22:48:00,Taking Stock of the Earnings Picture,neutral,0.9166557192802429,2025-05-28
"Top Research Reports for Costco, Chubb & Cigna",Yahoo,2025-05-23 21:00:00,"Top Research Reports for Costco, Chubb & Cigna",neutral,0.9333186149597168,2025-05-28
'Nobody Is Holding A Gun To My Head' Says 89-Year-Old Costco Co-Founder Who Still Goes To Work Because He Loves It,Yahoo,2025-05-23 17:30:55,'Nobody Is Holding A Gun To My Head' Says 89-Year-Old Costco Co-Founder Who Still Goes To Work Because He Loves It,neutral,0.9299622178077698,2025-05-28
"Wall Street Roundup: Retail Earnings, Reddit Volatility, AI Momentum",SeekingAlpha,2025-05-23 14:45:00,"Wall Street Roundup: Retail Earnings, Reddit Volatility, AI Momentum",neutral,0.9050257802009583,2025-05-28
"Nvidia Earnings, Fed Inflation Data Headline Investing Action Plan; Costco, Salesforce, Temu Parent Also Due",Yahoo,2025-05-23 14:18:58,"Nvidia Earnings, Fed Inflation Data Headline Investing Action Plan; Costco, Salesforce, Temu Parent Also Due",neutral,0.938262403011322,2025-05-28
"Stocks to watch next week: Nvidia, Salesforce, Dell, Costco and Kingfisher",Yahoo,2025-05-23 13:32:57,"Stocks to watch next week: Nvidia, Salesforce, Dell, Costco and Kingfisher",neutral,0.9229732155799866,2025-05-28
The Retail Accounting Method Walmart Says Will Drive Investors Crazy,MarketWatch,2025-05-23 11:50:00,The Retail Accounting Method Walmart Says Will Drive Investors Crazy,neutral,0.7963868379592896,2025-05-28
3 Mighty American Companies to Buy as Tariff Uncertainty Lingers,Yahoo,2025-05-23 09:45:00,3 Mighty American Companies to Buy as Tariff Uncertainty Lingers,positive,0.6178611516952515,2025-05-28
1 Unpopular Stock that Deserves a Second Chance and 2 to Be Wary Of,Yahoo,2025-05-23 04:42:03,1 Unpopular Stock that Deserves a Second Chance and 2 to Be Wary Of,neutral,0.824302613735199,2025-05-28
Target’s troubles leave analysts most negative since 2018,Yahoo,2025-05-22 20:44:53,Target’s troubles leave analysts most negative since 2018,negative,0.9701143503189087,2025-05-28
Burlington Stores (BURL) Expected to Beat Earnings Estimates: Can the Stock Move Higher?,Yahoo,2025-05-22 14:00:20,Burlington Stores (BURL) Expected to Beat Earnings Estimates: Can the Stock Move Higher?,positive,0.943648636341095,2025-05-28
Consumer Stocks Have Taken It on the Chin. Buy These 8.,MarketWatch,2025-05-22 14:00:00,Consumer Stocks Have Taken It on the Chin. Buy These 8.,neutral,0.8925722241401672,2025-05-28
"Zacks Investment Ideas feature highlights: TJX Companies, Costco, Ross Stores and Burlington Stores",Yahoo,2025-05-22 13:32:00,"Zacks Investment Ideas feature highlights: TJX Companies, Costco, Ross Stores and Burlington Stores",neutral,0.9457575082778931,2025-05-28
Trader Joe’s claims top spot in corporate reputation rankings,Yahoo,2025-05-22 11:52:00,Trader Joe’s claims top spot in corporate reputation rankings,positive,0.7653467655181885,2025-05-28
BJ’s Wholesale CEO warns that tariffs ‘may drive prices higher.’ Stock falls as sales disappoint.,MarketWatch,2025-05-22 11:27:00,BJ’s Wholesale CEO warns that tariffs ‘may drive prices higher.’ Stock falls as sales disappoint.,negative,0.9686591029167175,2025-05-28
"Costco Wholesale Corporation (NASDAQ:COST) Is The Only One That Can Compete With Walmart, Says Jim Cramer",Yahoo,2025-05-22 11:00:21,"Costco Wholesale Corporation (NASDAQ:COST) Is The Only One That Can Compete With Walmart, Says Jim Cramer",neutral,0.5579921007156372,2025-05-28
Target Q1 2025: The Kmart Warning Signs Are Hard To Ignore,SeekingAlpha,2025-05-22 09:02:58,Target Q1 2025: The Kmart Warning Signs Are Hard To Ignore,neutral,0.7044481039047241,2025-05-28
The world's 10 best cities to live in revealed,Yahoo,2025-05-22 05:00:20,The world's 10 best cities to live in revealed,neutral,0.5235046148300171,2025-05-28
VDC: Hold And Wait For A Better Gauge On Economic Direction,SeekingAlpha,2025-05-21 23:39:13,VDC: Hold And Wait For A Better Gauge On Economic Direction,neutral,0.8734651207923889,2025-05-28
Walmart Earnings Summary: Tariffs Not As Critical As Long-Term Flywheel Improvements,SeekingAlpha,2025-05-21 23:35:00,Walmart Earnings Summary: Tariffs Not As Critical As Long-Term Flywheel Improvements,neutral,0.7350797057151794,2025-05-28
Saks Fifth Avenue Brand Heads to Costco: Sources,Yahoo,2025-05-21 20:54:40,Saks Fifth Avenue Brand Heads to Costco: Sources,neutral,0.9383791089057922,2025-05-28
Robert Kiyosaki Says It's Not Toilet Paper Or Baked Beans Flying Off Costco Shelves—It's Gold. Here's What He Says It Means,Yahoo,2025-05-21 15:17:35,Robert Kiyosaki Says It's Not Toilet Paper Or Baked Beans Flying Off Costco Shelves—It's Gold. Here's What He Says It Means,neutral,0.9363377690315247,2025-05-28
Platinum Prices Are Rising. Why the Rally Could Just Be Getting Started.,MarketWatch,2025-05-21 14:34:00,Platinum Prices Are Rising. Why the Rally Could Just Be Getting Started.,neutral,0.8484364151954651,2025-05-28
"Target badly misses on earnings, slashes guidance as it battles DEI backlash and reinvigorated Walmart",Yahoo,2025-05-21 10:30:38,"Target badly misses on earnings, slashes guidance as it battles DEI backlash and reinvigorated Walmart",negative,0.969429612159729,2025-05-28
